{
  "version": 1,
  "generated_from": [
    "docs/metric_dictionary.md",
    "docs/page_contracts.md",
    "docs/calc_rules.md",
    "docs/golden_sample_catalog.md"
  ],
  "entities": [
    {
      "entity_id": "CONCEPT-formal_pnl",
      "entity_type": "BusinessConcept",
      "name": "正式损益",
      "aliases": ["formal PnL", "正式PnL", "正式损益", "formal_pnl"],
      "business_definition": "正式金融口径下的损益概念，具体归属由 docs/calc_rules.md 的 Formal PnL 规则约束。",
      "unit": null,
      "basis": "formal",
      "time_semantics": "report_date",
      "fallback_allowed": false,
      "authority": ["docs/calc_rules.md#3-formal-pnl"],
      "status": "approved"
    },
    {
      "entity_id": "CALC-PNL-FORMAL-MATRIX",
      "entity_type": "CalculationRule",
      "name": "Formal PnL 归属矩阵",
      "aliases": ["formal recognition matrix", "formal PnL matrix", "正式损益归属矩阵"],
      "business_definition": "514/516/517/manual_adjustment 是否进入 formal total_pnl 的会计归属规则。",
      "unit": null,
      "basis": "formal",
      "time_semantics": "report_date",
      "fallback_allowed": false,
      "authority": ["docs/calc_rules.md#33-formal-归属矩阵"],
      "status": "approved"
    },
    {
      "entity_id": "CALC-PNL-BRIDGE",
      "entity_type": "CalculationRule",
      "name": "PnL Bridge 归因规则",
      "aliases": ["PnL Bridge", "pnl bridge rule", "桥接归因"],
      "business_definition": "PnL Bridge 的正式归因结构和质量边界由 calc_rules 的桥接归因章节约束。",
      "unit": null,
      "basis": "formal",
      "time_semantics": "report_date",
      "fallback_allowed": false,
      "authority": ["docs/calc_rules.md#9-桥接归因"],
      "status": "approved"
    },
    {
      "entity_id": "CALC-RISK-TENSOR",
      "entity_type": "CalculationRule",
      "name": "风险张量规则",
      "aliases": ["risk tensor rule", "风险张量"],
      "business_definition": "风险张量指标的正式风险口径由 calc_rules 的风险张量章节约束。",
      "unit": null,
      "basis": "formal",
      "time_semantics": "report_date",
      "fallback_allowed": false,
      "authority": ["docs/calc_rules.md#10-风险张量"],
      "status": "approved"
    },
    {
      "entity_id": "GS-BAL-OVERVIEW-A",
      "entity_type": "GoldenSample",
      "name": "Balance overview golden sample A",
      "aliases": ["GS-BAL-OVERVIEW-A"],
      "business_definition": "Balance overview capture-ready sample for formal balance headline metrics.",
      "unit": null,
      "basis": "formal",
      "time_semantics": "sample",
      "fallback_allowed": false,
      "authority": ["tests/golden_samples/GS-BAL-OVERVIEW-A"],
      "status": "approved"
    },
    {
      "entity_id": "GS-PNL-OVERVIEW-A",
      "entity_type": "GoldenSample",
      "name": "Formal PnL overview golden sample A",
      "aliases": ["GS-PNL-OVERVIEW-A"],
      "business_definition": "Formal PnL overview capture-ready sample for approved overview metrics.",
      "unit": null,
      "basis": "formal",
      "time_semantics": "sample",
      "fallback_allowed": false,
      "authority": ["tests/golden_samples/GS-PNL-OVERVIEW-A"],
      "status": "approved"
    },
    {
      "entity_id": "GS-BRIDGE-A",
      "entity_type": "GoldenSample",
      "name": "PnL bridge golden sample A",
      "aliases": ["GS-BRIDGE-A"],
      "business_definition": "PnL bridge capture-ready sample for bridge summary and row truth.",
      "unit": null,
      "basis": "formal",
      "time_semantics": "sample",
      "fallback_allowed": false,
      "authority": ["tests/golden_samples/GS-BRIDGE-A"],
      "status": "approved"
    },
    {
      "entity_id": "GS-RISK-A",
      "entity_type": "GoldenSample",
      "name": "Risk tensor golden sample A",
      "aliases": ["GS-RISK-A"],
      "business_definition": "Risk tensor capture-ready sample for formal risk tensor output.",
      "unit": null,
      "basis": "formal",
      "time_semantics": "sample",
      "fallback_allowed": false,
      "authority": ["tests/golden_samples/GS-RISK-A"],
      "status": "approved"
    },
    {
      "entity_id": "GS-PROD-CAT-PNL-A",
      "entity_type": "GoldenSample",
      "name": "Product-category PnL golden sample A",
      "aliases": ["GS-PROD-CAT-PNL-A"],
      "business_definition": "Product-category PnL capture-ready sample for approved headline metrics.",
      "unit": null,
      "basis": "formal",
      "time_semantics": "sample",
      "fallback_allowed": false,
      "authority": ["tests/golden_samples/GS-PROD-CAT-PNL-A"],
      "status": "approved"
    },
    {
      "entity_id": "MTR-BAL-001",
      "entity_type": "Metric",
      "name": "总市值",
      "aliases": ["总市值", "total_market_value_amount", "MTR-BAL-001"],
      "business_definition": "Balance Analysis 的总市值指标，绑定 formal balance overview 的 total_market_value_amount 字段。",
      "unit": "yuan",
      "basis": "formal",
      "precision": 2,
      "time_semantics": "report_date/resolved_report_date",
      "null_semantics": "missing formal balance source is not zero",
      "fallback_allowed": false,
      "authority": ["docs/metric_dictionary.md#6-balance-analysis", "docs/calc_rules.md#12-zqtz--tyw-formal-balance"],
      "source_fields": ["BalanceAnalysisOverviewPayload.total_market_value_amount"],
      "result_meta_requirements": ["basis=formal", "source_surface=formal_balance", "fallback_mode=none"],
      "tests": ["tests/test_balance_analysis_api.py"],
      "golden_samples": ["tests/golden_samples/GS-BAL-OVERVIEW-A"],
      "status": "approved"
    },
    {
      "entity_id": "MTR-PNL-001",
      "entity_type": "Metric",
      "name": "利息收入（514）",
      "aliases": ["利息收入", "interest_income_514", "MTR-PNL-001"],
      "business_definition": "Formal PnL 的 514 利息收入指标，进入 formal total 的条件由 Formal PnL 归属矩阵约束。",
      "unit": "yuan",
      "basis": "formal",
      "precision": 2,
      "time_semantics": "report_date",
      "null_semantics": "missing formal source is not zero",
      "fallback_allowed": false,
      "authority": ["docs/metric_dictionary.md#7-formal-pnl", "docs/calc_rules.md#3-formal-pnl"],
      "source_fields": ["PnlFormalFiRow.interest_income_514", "PnlOverviewPayload.interest_income_514"],
      "calculation_rules": ["CALC-PNL-FORMAL-MATRIX"],
      "result_meta_requirements": ["basis=formal", "source_surface=formal_pnl", "fallback_mode=none"],
      "tests": ["tests/test_pnl_formal_semantics_contract.py"],
      "golden_samples": ["tests/golden_samples/GS-PNL-OVERVIEW-A"],
      "status": "approved"
    },
    {
      "entity_id": "MTR-PNL-002",
      "entity_type": "Metric",
      "name": "公允价值变动（516）",
      "aliases": ["公允价值变动", "fair_value_change_516", "MTR-PNL-002"],
      "business_definition": "Formal PnL 的 516 公允价值变动指标，是否进入 formal total 取决于会计分类。",
      "unit": "yuan",
      "basis": "formal",
      "precision": 2,
      "time_semantics": "report_date",
      "null_semantics": "missing formal source is not zero",
      "fallback_allowed": false,
      "authority": ["docs/metric_dictionary.md#7-formal-pnl", "docs/calc_rules.md#4-516-规则"],
      "source_fields": ["PnlFormalFiRow.fair_value_change_516", "PnlOverviewPayload.fair_value_change_516"],
      "calculation_rules": ["CALC-PNL-FORMAL-MATRIX"],
      "result_meta_requirements": ["basis=formal", "source_surface=formal_pnl", "fallback_mode=none"],
      "tests": ["tests/test_pnl_formal_semantics_contract.py"],
      "golden_samples": ["tests/golden_samples/GS-PNL-OVERVIEW-A"],
      "status": "approved"
    },
    {
      "entity_id": "MTR-PNL-005",
      "entity_type": "Metric",
      "name": "正式总损益",
      "aliases": ["正式总损益", "total_pnl", "formal total PnL", "MTR-PNL-005"],
      "business_definition": "Formal PnL 的 recognized total_pnl 指标，不等同于 standardized total。",
      "unit": "yuan",
      "basis": "formal",
      "precision": 2,
      "time_semantics": "report_date",
      "null_semantics": "missing formal source is not zero",
      "fallback_allowed": false,
      "authority": ["docs/metric_dictionary.md#7-formal-pnl", "docs/calc_rules.md#3-formal-pnl"],
      "source_fields": ["PnlOverviewPayload.total_pnl"],
      "calculation_rules": ["CALC-PNL-FORMAL-MATRIX"],
      "result_meta_requirements": ["basis=formal", "source_surface=formal_pnl", "fallback_mode=none"],
      "tests": ["tests/test_pnl_formal_semantics_contract.py"],
      "golden_samples": ["tests/golden_samples/GS-PNL-OVERVIEW-A"],
      "status": "approved"
    },
    {
      "entity_id": "MTR-BRG-011",
      "entity_type": "Metric",
      "name": "可解释损益",
      "aliases": ["可解释损益", "explained_pnl", "MTR-BRG-011"],
      "business_definition": "PnL Bridge 的核心解释输出指标。",
      "unit": "yuan",
      "basis": "formal",
      "precision": 2,
      "time_semantics": "report_date",
      "null_semantics": "missing bridge source is not zero",
      "fallback_allowed": false,
      "authority": ["docs/metric_dictionary.md#8-pnl-bridge", "docs/calc_rules.md#9-桥接归因"],
      "source_fields": ["PnlBridgeSummarySchema.explained_pnl"],
      "calculation_rules": ["CALC-PNL-BRIDGE"],
      "result_meta_requirements": ["basis=formal", "source_surface=pnl_bridge", "fallback_mode=none"],
      "tests": ["tests/test_pnl_bridge_core.py"],
      "golden_samples": ["tests/golden_samples/GS-BRIDGE-A"],
      "status": "approved"
    },
    {
      "entity_id": "MTR-BRG-012",
      "entity_type": "Metric",
      "name": "实际损益",
      "aliases": ["实际损益", "actual_pnl", "MTR-BRG-012"],
      "business_definition": "PnL Bridge 的对账目标值指标。",
      "unit": "yuan",
      "basis": "formal",
      "precision": 2,
      "time_semantics": "report_date",
      "null_semantics": "missing bridge source is not zero",
      "fallback_allowed": false,
      "authority": ["docs/metric_dictionary.md#8-pnl-bridge", "docs/calc_rules.md#9-桥接归因"],
      "source_fields": ["PnlBridgeSummarySchema.actual_pnl"],
      "calculation_rules": ["CALC-PNL-BRIDGE"],
      "result_meta_requirements": ["basis=formal", "source_surface=pnl_bridge", "fallback_mode=none"],
      "tests": ["tests/test_pnl_bridge_core.py"],
      "golden_samples": ["tests/golden_samples/GS-BRIDGE-A"],